{
  "$schema": "http://json-schema.org/draft-07/schema#",
  "type": "object",
  "additionalProperties": false,
  "properties": {
    "schemaVersion": {
      "const": 1
    },
    "caseId": {
      "type": "string",
      "pattern": "^[a-z0-9][a-z0-9-]*$"
    },
    "events": {
      "type": "array",
      "items": {
        "type": "object",
        "additionalProperties": false,
        "properties": {
          "id": {
            "type": "string",
            "pattern": "^[a-z0-9][a-z0-9-]*$"
          },
          "after": {
            "type": "array",
            "items": {
              "type": "string",
              "pattern": "^[a-z0-9][a-z0-9-]*$"
            },
            "minItems": 0
          },
          "kind": {
            "enum": [
              "user-message",
              "human-edit",
              "restart-session",
              "evidence-update"
            ]
          },
          "delivery": {
            "enum": [
              "message",
              "operator"
            ]
          },
          "payload": {
            "type": "string",
            "minLength": 1
          },
          "checkpoint": {
            "type": "string",
            "pattern": "^[a-z0-9][a-z0-9-]*$"
          },
          "instructions": {
            "type": "string",
            "minLength": 1
          },
          "assets": {
            "type": "array",
            "items": {
              "type": "object",
              "additionalProperties": false,
              "properties": {
                "path": {
                  "type": "string",
                  "minLength": 1
                },
                "sha256": {
                  "type": "string",
                  "pattern": "^[a-f0-9]{64}$"
                }
              },
              "required": [
                "path",
                "sha256"
              ]
            },
            "minItems": 1
          }
        },
        "required": [
          "id",
          "after",
          "kind",
          "delivery",
          "payload",
          "checkpoint",
          "instructions"
        ]
      },
      "minItems": 0
    },
    "checkpoints": {
      "type": "array",
      "items": {
        "type": "object",
        "additionalProperties": false,
        "properties": {
          "id": {
            "type": "string",
            "pattern": "^[a-z0-9][a-z0-9-]*$"
          },
          "description": {
            "type": "string",
            "minLength": 1
          }
        },
        "required": [
          "id",
          "description"
        ]
      },
      "minItems": 1
    }
  },
  "required": [
    "schemaVersion",
    "caseId",
    "events",
    "checkpoints"
  ]
}
